{"contract_version":"v1","run_id":"run_v1_01J8Q3Z4R5T6V7W8X9Y0ABCDEF","definition_id":"definition_v1_01J8Q3Z4R5T6V7W8X9Y0ABCDEF","workflow_id":"workflow_v1_01J8Q3Z4R5T6V7W8X9Y0ABCDEF","workflow_version":3,"definition_revision":5,"definition_hash":"sha256:aaaaaaaaaaaaaaaaaaaaaaaaaaaaaaaaaaaaaaaaaaaaaaaaaaaaaaaaaaaaaaaa","request_id":"request_v1_01J8Q3Z4R5T6V7W8X9Y0ABCDEF","task_ref":"task_v1_01J8Q3Z4R5T6V7W8X9Y0ABCDEF","project_ref":"project_v1_01J8Q3Z4R5T6V7W8X9Y0ABCDEF","trace_id":"trace_v1_01J8Q3Z4R5T6V7W8X9Y0ABCDEF","mode":"manual","revision":4,"status":"succeeded","event_history":[{"status":"queued","occurred_at":"2026-07-31T09:00:00Z","revision":1},{"status":"waiting_for_approval","occurred_at":"2026-07-31T09:00:01Z","revision":2},{"status":"running","occurred_at":"2026-07-31T09:00:02Z","revision":3},{"status":"succeeded","occurred_at":"2026-07-31T09:00:03Z","revision":4}],"counters":{"executed_steps":7,"max_steps":50,"retry_count":0,"max_retries":2},"budget":{"max_cost_minor":750,"currency":"EUR","quote_ref":"quote_v1_01J8Q3Z4R5T6V7W8X9Y0ABCDEF","approval_ref":"approval_v1_01J8Q3Z4R5T6V7W8X9Y0ABCDEF"},"cancellation_requested":false,"evidence_refs":["evidence_v1_01J8Q3Z4R5T6V7W8X9Y0ABCDEF"],"artifact_refs":["artifact_v1_01J8Q3Z4R5T6V7W8X9Y0ABCDEF"],"log_refs":["log_v1_01J8Q3Z4R5T6V7W8X9Y0ABCDEF"]}
